"first_author","affiliation","publications","citations","year_start","year_end","top_topics","publication_types","top_authors","top_journals","top_institutions","top_conferences","not_found"
"Nabilatul Hani Mohd-Radzman","Universiti Teknologi MARA","3",21,2013,2016,"Stevia rebaudiana|Medicine|3T3-L1|Stevioside|Insulin|Kinase|Adipokine|Insulin resistance|Hyperinsulinemia|Type ii diabetes","Journal publications","Aishah Adam|Zainah Adam|Siti Safura Jaapar|Wan Iryani Wan Ismail","Evidence-based Complementary and Alternative Medicine","Malaysian Nuclear Agency|Universiti Teknologi MARA",NA,NA
"Zhiqiang Wang",NA,"2",5,2014,2015,"Biochemistry|Medicine|Molecular biology|Gene knockdown|Apoptosis|Western blot|MTT assay|Cell cycle|Viability assay|Flow cytometry","Journal publications","Xindong Zhang|Dalin Sun|Baofang Jin|Yugui Cui|Chao Gao","Evidence-based Complementary and Alternative Medicine",NA,NA,NA
"Ya-min Zhang","Peking Union Medical College Hospital","5",49,2014,2020,"Pharmacology|Medicine|Electroacupuncture|Ischemia|Reperfusion injury|Stroke|Anesthesia|Acupuncture|Aquaporin 4|Brain ischemia","Journal publications","Sun H|Suhui Chen|Hong Xu|Fuming Wang|Fu-ming Wang|Ying-kui Si|Huanyuan Wang","PLOS ONE|Evidence-based Complementary and Alternative Medicine|Nitric Oxide","Peking Union Medical College Hospital",NA,NA
"Lilian Amrein","Jewish General Hospital","18",1016,2007,2017,"Internal medicine|Biology|Endocrinology|Insulin|Metformin|Cancer|AMPK|Medicine|Cancer research|DNA damage","Journal publications","Michael Pollak|Carolyn Algire|Lawrence Panasci|Raquel Aloyz|Mahvash Zakikhani|Olga Moiseeva|Luca A. Petruccelli|Xavier Deschênes-Simard|Elena Birman|Gerardo Ferbeyre","Cancer Prevention Research|Oncogene|Endocrine-related Cancer|Frontiers in Pharmacology|Chemical Science|British Journal of Haematology|Leukemia Research|Journal of Pharmacology and Experimental Therapeutics|Cancer Chemotherapy and Pharmacology|Cancer Research","Jewish General Hospital|McGill University|University of Manitoba|Université de Montréal|University of Pittsburgh|University of Cambridge|McGill University Health Centre|Dalhousie University|Cross Cancer Institute|University of Calgary",NA,NA
"Gong Yang","Fudan University","34",2505,2004,2016,"Biology|Ovarian cancer|Cancer|Cancer research|Carcinogenesis|Immunology|Molecular biology|Cell cycle|Oncogene|Cell biology","Journal publications","Jinsong Liu|Imelda Mercado-Uribe|Daniel G. Rosen|Robert C. Bast|Gordon B. Mills|Guangzhi Liu|Xue Xiao|Bin Chang|Jennifer A. Thompson-Lanza|Xiaoqing Guo","Clinical Cancer Research|Proceedings of the National Academy of Sciences of the United States of America|Cancer Research|Journal of Biological Chemistry|Cancer|International Journal of Cancer|Journal of the National Cancer Institute|Molecular Cancer Therapeutics|Frontiers in Bioscience|Cell Cycle","University of Texas MD Anderson Cancer Center|Fudan University|University of British Columbia|Harvard University|Sichuan University|University of California, Los Angeles|Boston University|University of Tokyo|Shanghai Normal University|University of Alberta",NA,NA
"Sujit K. Bhutia","National Institute of Technology, Rourkela","111",9693,2006,2020,"Biology|Autophagy|Cell biology|Programmed cell death|Vacuole|Autophagosome|Lysosome|Chaperone-mediated autophagy|MAP1LC3B|Autolysosome","Journal publications|Other","Paul Dent|Rajesh Agarwal|Saverio Bettuzzi|Susana Castro-Obregon|Michele Caraglia|Stefan Böckler|Monika Cahova|Hikmet Budak|Fraser P. Coxon|Jayanta Debnath","Autophagy|Cancer Research|Apoptosis|Biochimica et Biophysica Acta|Journal of Cellular Physiology|International Immunopharmacology|Proceedings of the National Academy of Sciences of the United States of America|Analyst|Dalton Transactions|Oral Oncology","National Institute of Technology, Rourkela|Virginia Commonwealth University|Kyung Hee University|Washington University in St. Louis|Indian Institute of Science|Icahn School of Medicine at Mount Sinai|University of Alabama at Birmingham|University of Colorado Denver|University of Chicago|Columbia University",NA,NA
"Upal K. Basu Roy","University of Arizona","6",250,2006,2015,"Biology|Cancer research|Cell biology|Protein kinase B|Carcinogenesis|Molecular biology|Caveolae|Caveolin 1|Cell migration|RHOA","Journal publications","Eugene W. Gerner|Natalia A. Ignatenko|Rebecca S. Henkhaus|Fotios Loupakis|Chiara Cremolini|Nathaniel S. Rial|Karen L. Kachel|Dora Cavallo-Medved|Bonnie F. Sloane|Karen A. Blohm-Mangone","International Journal of Cancer|Molecular Carcinogenesis|Neoplasia|Nutrition and Cancer","University of Arizona|University of Pisa|Wayne State University|Celgene",NA,NA
"Teresa Lorenzi","Marche Polytechnic University","53",749,1996,2019,"Biology|Internal medicine|Endocrinology|Medicine|Pathology|Anatomy|Placenta|Immunostaining|Biochemistry|Receptor","Journal publications|Other|Repository papers|Patents","Mario Castellucci|Daniela Marzioni|Manrico Morroni|Francesca Paolinelli|Adolfo Amici|Maria Lorenzi|Giulio Magni|Nadia Raffaelli|Pasquapina Ciarmela|Andrea L. Tranquilli","PLOS ONE|Placenta|Histology and Histopathology|Journal of Anatomy|Cytokine & Growth Factor Reviews|Journal of Bacteriology|Neurosurgery|Peptides|Journal of Cellular Physiology|International Journal of Cancer","Marche Polytechnic University|University of Turin|United Hospitals|University of Santiago, Chile|University of Naples Federico II|University of Siena|Kore University of Enna|Unica Corporation|Seconda Università degli Studi di Napoli|Catholic University of the Sacred Heart",NA,NA
"Jing Huang","Boston Children's Hospital","34",2157,2007,2020,"Nanoparticle|Iron oxide nanoparticles|Materials science|In vivo|Nanotechnology|Biology|Magnetic nanoparticles|Chemistry|Magnetic resonance imaging|Nanoconjugates","Journal publications|Other","Hui Mao|Peng Guo|Xingguo Li|Liya Wang|Jin Xie|Xiaoyuan Chen|Marsha A. Moses|Kai Chen|Lily Yang|Debra T. Auguste","Biomaterials|Proceedings of the National Academy of Sciences of the United States of America|ACS Nano|Chemical Communications|Theranostics|Journal of Materials Chemistry B|Nature Communications|Advanced Functional Materials|ACS Applied Materials & Interfaces|Small","Boston Children's Hospital|Emory University|Peking University|Stanford University|Harvard University|City College of New York|Northeastern University|National Institutes of Health|Harbin Medical University|Brigham and Women's Hospital",NA,NA
"Emanuela Rosati","University of Perugia","58",1407,1990,2019,"Immunology|Biology|Chronic lymphocytic leukemia|Cell biology|Medicine|Molecular biology|Notch signaling pathway|Apoptosis|Signal transduction|Mutation","Journal publications|Other","Pierfrancesco Marconi|Franca Falzetti|Mauro Di Ianni|Isabella Screpanti|Stefano Baldoni|Paolo Sportoletti|Katia Fettucciari|Rita Sabatini|Beatrice Del Papa|Andrea Bartoli","Blood|British Journal of Haematology|Leukemia|International Journal of Cancer|Frontiers in Oncology|Oncotarget|Best Practice & Research Clinical Haematology|Journal of Immunology|European Journal of Immunology|Immunology","University of Perugia|University of L'Aquila|Sapienza University of Rome|University of Chieti-Pescara|Stanford University|Weizmann Institute of Science|Boston Children's Hospital|Universidade Federal do Espírito Santo|Istituto Superiore di Sanità|National Research Council",NA,NA
"Gayathri Chadalapaka","Texas A&M University","34",2686,2007,2018,"Biology|Molecular biology|Cancer research|Cell growth|Pancreatic cancer|Gene knockdown|RNA interference|HOTAIR|Survivin|Transcription factor","Journal publications|Other","Stephen Safe|Indira Jutooru|Kyounghyun Kim|Robert C. Burghardt|Greg A. Johnson|Sang Bae Kim|James H. Frank|Satya S. Pathi|Sudhakar Chintharlapalli|Sabitha Papineni","Oncogene|Cancer Research|Journal of Biological Chemistry|International Journal of Cancer|Molecular Cancer Research|Oncotarget|Carcinogenesis|Bioorganic & Medicinal Chemistry Letters|PLOS ONE|Molecular and Cellular Biology","Texas A&M University|Texas A&M Health Science Center|University of Texas MD Anderson Cancer Center|University of Paris|Curie Institute|Baylor College of Medicine|Chonbuk National University|Wellington Management Company|University of Cincinnati|University of Illinois at Chicago",NA,NA
"Baoyi Zhu","Sun Yat-sen University","7",41,2011,2013,"Cancer research|Biology|Medicine|Surgery|Ureter|Urology|Gene silencing|Phosphorylation|Apoptosis|Small interfering RNA","Journal publications","Xingqiao Wen|Chunwei Ye|Yi Cai|Songwang Cai|Huaiqiu Huang|Yu Wang|Xiaojuan Li|Yuying Zhang|Yiran Tao|Ruihan Chen","International Journal of Cancer|Journal of Endourology|Laboratory Investigation|Open Journal of Urology|Clinical and Investigative Medicine|Current Urology","Sun Yat-sen University|University of Rochester Medical Center",NA,NA
"Jing Hu","State University of New York System","1",22,2011,2011,"Cancer|Cell|Apoptosis|Cyclin D1|Cisplatin|Ovarian cancer|Cancer research|Cell growth|Cell culture|Biology","Journal publications","Hassan Nakhla|Eileen Friedman","International Journal of Cancer","State University of New York System|State University of New York Upstate Medical University",NA,NA
"R. van Gelderen","University of Tasmania","4",168,2007,2010,"Biology|Fishery|Welfare|Ecology|Morality|Animal ethics|Information quality|Animal welfare|Tenacibaculum maritimum|Salmo","Journal publications","Natalie A. Moltschaniwskyj|José Eduardo A. R. Marian|David L. Sinn|Billy Sinclair|Marek R. Lipinski|Mitsuo Sakai|Roger Villanueva|K. Warnke|M. K. Nishiguchi|D.J. Shulman","Reviews in Fish Biology and Fisheries|Diseases of Aquatic Organisms|Journal of Fish Diseases|Journal of Applied Microbiology","University of Tasmania|New Mexico State University|Spanish National Research Council|University of São Paulo|University of Massachusetts Amherst|Central Queensland University|Stanford University|Australian Animal Health Laboratory",NA,NA
"Robert P. Ryan","University of Dundee","57",4408,2006,2018,"Biology|Microbiology|Genetics|Xanthomonas campestris|Virulence|Xanthomonas|Cyclic di-GMP|Bacteria|Biochemistry|Genome","Journal publications|Other","J. Maxwell Dow|Yvonne McCarthy|Adam J. Bogdanove|Shi-Qi An|Prabhu B. Patil|Frank F. White|Ralf Koebnik|Steven L. Salzberg|Ramesh V. Sonti|Jan E. Leach","Molecular Microbiology|Nature Reviews Microbiology|BMC Genomics|Journal of Bacteriology|Proceedings of the National Academy of Sciences of the United States of America|PLOS ONE|Trends in Microbiology|PLOS Pathogens|Journal of Molecular Biology|The EMBO Journal","University College Cork|University of Dundee|Iowa State University|Council of Scientific and Industrial Research|Kansas State University|Colorado State University|University of Maryland, College Park|Wellcome Trust Sanger Institute|University of Maryland, Baltimore|Kyoto Prefectural University",NA,NA
"Laurent Guillon","University of Strasbourg","14",673,2005,2016,"Siderophore|Biology|Pyoverdine|Biochemistry|Periplasmic space|Secretion|Cytoplasm|Pseudomonas aeruginosa|Bacteria|Microbiology","Journal publications","Isabelle J. Schalk|Vincent Croquette|David Bensimon|Thierry Mora|Nicolas Desprat|Thomas Julou|Laure Journet|Iain L. Lamont|Emilie Yeterian|Lois W. Martin","Environmental Microbiology|Amino Acids|Proceedings of the National Academy of Sciences of the United States of America|FEBS Letters|Biochemistry|Organic Letters|Journal of Inorganic Biochemistry|PLOS ONE|ACS Chemical Biology|Methods in Enzymology","University of Strasbourg|Centre national de la recherche scientifique|University of California, Los Angeles|École Normale Supérieure|University of Otago|Autonomous University of Barcelona|University of Rouen|University of Barcelona|University of Marburg|University of Freiburg",NA,NA
"Lei-Chin Chen","I-Shou University","6",34,2011,2015,"Biology|Genetics|Apoptosis|Gene|DNA damage|Molecular biology|Comet assay|DNA repair|Gene expression|Mutagen","Journal publications","Ssu-Ching Chen|You-Cheng Hseu|Jong-C. Wu|Chin-H. Chen|Jui-Shan Tsai|Soi M. Chye|Yen-Fan Tuan|Jung-Chi Chen|Jwu-Ching Shu|Chien-Yen Chen","Environmental and Molecular Mutagenesis|Environmental Microbiology|International Journal of Medical Microbiology|Environmental Toxicology","National Kaohsiung Normal University|I-Shou University|National Central University|China Medical University (PRC)|Fooyin University|Taipei Medical University|International Medical University|National Chung Cheng University|Chang Gung University|University of Memphis",NA,NA
"Isao Hara","Wakayama Medical University","412",8543,1987,2020,"Medicine|Urology|Cancer|Surgery|Prostate cancer|Pathology|Internal medicine|Biology|Bladder cancer|Cancer research","Journal publications|Other","Hideaki Miyake|Sadao Kamidono|Masato Fujisawa|Soichi Arakawa|Hiroshi Eto|Yasuo Kohjimoto|Hiroshi Okada|Shoji Hara|Kazuki Yamanaka|Mototsugu Muramaki","International Journal of Urology|The Journal of Urology|Urology|BJUI|Clinical Cancer Research|Oncology Reports|Urologia Internationalis|Urologic Oncology-seminars and Original Investigations|Cancer Immunology, Immunotherapy|International Urology and Nephrology","Kobe University|Wakayama Medical University|University of British Columbia|Vancouver General Hospital|Iwate Medical University|Kyoto Prefectural University of Medicine|University of Tokyo|Kindai University|Sapporo Medical University|Akita University",NA,NA
"Noritoshi Kitamoto","University of Hyogo","58",1732,1980,2019,"Chemistry|Biology|Monoclonal antibody|Biochemistry|Virology|Molecular biology|Epitope|Capsid|Norwalk virus|Virus","Journal publications","Tomoyuki Tanaka|Yoji Kato|Mary K. Estes|Enoch Y. Park|Tian-Cheng Li|Tetsuro Suzuki|Naokazu Takeda|Akari Ishisaka|Toshihiko Osawa|Yoko Nitta","Journal of Agricultural and Food Chemistry|Biosensors and Bioelectronics|Journal of Virology|Free Radical Biology and Medicine|Journal of Clinical Microbiology|Clinical and Vaccine Immunology|Biochemical and Biophysical Research Communications|Journal of Biological Chemistry|Chemical Research in Toxicology|Microbiology and Immunology","University of Hyogo|National Institutes of Health|Nagoya University|Baylor College of Medicine|Shizuoka University|Hamamatsu University|Eastern Virginia Medical School|Sugiyama Jogakuen University|University of Tokushima|Tohoku University",NA,NA
"Kotla Siva Reddy","Indian Veterinary Research Institute","2",7,2010,2012,"Molecular biology|Biology|Virology|DNA vaccination|Naked DNA|Vaccination|Plasmid|Virus|Inactivated vaccine|Immunity","Journal publications","H.J. Dechamma|Veluvarthy V.S. Suryanarayana|G. R. Reddy|Susarla Gopalakrishna|Brabhi R. Rashmi|N. Banumathi|Dowlathabad. Muralidhar Rao","Journal of Gene Medicine|Microbiology and Immunology","Indian Veterinary Research Institute|Australian National Drag Racing Association",NA,NA
"H. Liu","Central South University","948",20428,1983,2020,"Chemistry|Organic chemistry|Catalysis|Biochemistry|Biology|Nanotechnology|Stereochemistry|Medicine|Inorganic chemistry|Materials science","Journal publications|Repository papers|Patents|Other|Conference publications","Hualiang Jiang|Jiang Wang|Yu Zhou|Deju Ye|José Luis Aceña|Vadim A. Soloshonok|Kaixian Chen|Enguang Feng|Yu Zhou|He Huang","ChemInform|Chemical Reviews|Journal of Organic Chemistry|Bioorganic & Medicinal Chemistry|Journal of Medicinal Chemistry|Advanced Synthesis & Catalysis|Chemical Communications|RSC Advances|Green Chemistry|Organic Letters","Chinese Academy of Sciences|Shanghai University|Central South University|China Pharmaceutical University|East China University of Science and Technology|Southeast University|ShanghaiTech University|Ikerbasque|University of the Basque Country|Nanjing University","SOPO: Symposium on Photonics and Optoelectronics|IEMDC: International Electric Machines and Drives Conference",NA
"Sandrine Koechler","University of Strasbourg","26",946,2005,2020,"Biology|Arsenite|Bacteria|Arsenic|Microbiology|Ecology|Herminiimonas arsenicoxydans|Genome|Microorganism|Genetics","Journal publications|Other|Book chapters","Philippe N. Bertin|Florence Arsène-Ploetze|Jessica Cleiss-Arnold|Claudine Médigue|Marie Marchal|Didier Lièvremont|Jean-Yves Coppée|Valérie Barbe|Violaine Bonnefoy|Jean Weissenbach","PLOS Genetics|The ISME Journal|BMC Microbiology|Biochimie|PLOS ONE|Research in Microbiology|Genome Biology and Evolution|Frontiers in Microbiology|International Journal of Systematic and Evolutionary Microbiology|BMC Genomics","University of Strasbourg|Centre national de la recherche scientifique|Pasteur Institute|University of Lyon|Institut national de la recherche agronomique|Aix-Marseille University|Helmholtz Centre for Environmental Research - UFZ|University of Montpellier|French Alternative Energies and Atomic Energy Commission|University of Paris-Sud",NA,NA
"Scarlett R Holdsworth","Queen's University Belfast","6",93,2012,2014,"Escherichia coli|Biology|Major facilitator superfamily|Biochemistry|Transporter|Efflux|Membrane transport protein|Microbiology|Antiporter|Active transport","Journal publications|Other","Christopher J. Law|Paul McVeigh|Kamela O. Alegre|James A. Brown|Stephanie Paul|Sharon M. Kelly|Matthew Rice","Molecular Microbiology|BMC Microbiology|Journal of Antimicrobial Chemotherapy|Biochimie","Queen's University Belfast|University of Glasgow",NA,NA
"Daniel C Kraushaar","National Institutes of Health","7",344,2010,2018,"Biology|Molecular biology|Genetics|Histone|Chromatin|Nucleosome|Transcription factor|Cellular differentiation|Fibroblast growth factor|Embryonic stem cell","Journal publications","Lianchun Wang|Keji Zhao|Misook Ha|Yu Yamaguchi|Stephen Dalton|Brian J. Abraham|Wenfei Jin|Alika K. Maunakea|Eduard Condac|Kelley W. Moremen","Journal of Biological Chemistry|Genome Biology|International Journal of Biological Sciences|Epigenetics & Chromatin|Biological Chemistry|Genome Research","Samsung|National Institutes of Health",NA,NA
"Arumugam Nagalingam","Johns Hopkins University","42",954,2009,2019,"Cancer research|Biology|Carcinogenesis|Cancer|Medicine|Cancer cell|Adiponectin|Immunology|Leptin|Breast cancer","Journal publications|Other","Neeraj K. Saxena|Dipali Sharma|Dipali Sharma|Panjamurthy Kuppusamy|Jack L. Arbiser|Michael Y. Bonner|Dimiter Avtanski|Cynthia Cohen|Nethaji Muniraj|Balázs Gyorffy","Cancer Research|Oncogene|Carcinogenesis|Gastroenterology|Oncotarget|Molecular Oncology|Hepatology|Breast Cancer Research|Neoplasia|Current Bioactive Compounds","Emory University|University of Maryland, Baltimore|Johns Hopkins University|Johns Hopkins University School of Medicine|Semmelweis University|United States Department of Veterans Affairs|Stanford University|National Institutes of Health|Harvard University|Morehouse School of Medicine",NA,NA
"Ingunn Holen","University of Sheffield","192",7529,1990,2020,"Medicine|Breast cancer|Zoledronic acid|Cancer research|Cancer|Pathology|Internal medicine|Biology|Immunology|Metastasis","Journal publications|Other|Repository papers|Patents","Penelope D. Ottewell|Robert E. Coleman|Peter I. Croucher|Hannah K. Brown|Nicola J. Brown|Colby L. Eaton|R.E. Coleman|Valerie Speirs|Diane V. Lefley|Simon S. Cross","Breast Cancer Research|Cancer Treatment Reviews|Cancer Research|Breast Cancer Research and Treatment|International Journal of Cancer|Clinical Cancer Research|Journal of the National Cancer Institute|Annals of Oncology|Bone|Blood","University of Sheffield|University of Leeds|University of Oxford|University of Manchester|Cardiff University|Institute of Cancer Research|University of Glasgow|University of Birmingham|Harvard University|Brighton and Sussex Medical School",NA,NA
"Meiou Dai","McGill University","11",315,2008,2018,"Cancer research|Biology|Breast cancer|Cancer|Medicine|Triple-negative breast cancer|Molecular biology|Metastasis|Internal medicine|Transforming growth factor beta","Journal publications","Jean-Jacques Lebrun|Suhad Ali|Jun Tian|Nadège Fils-Aimé|Jimin Guo|Amal A Al-Odaini|Fatmah Al Raffa|Shafaat A. Rabbani|Ani Arakelian|Chieh Lo","Journal of Biological Chemistry|Breast Cancer Research|Scientific Reports|British Journal of Cancer|Cellular Signalling|Cancer Research","McGill University|Malaysian Ministry of Higher Education|St Mary's Hospital|Third Military Medical University",NA,NA
"Yi Fang Lee","Genome Institute of Singapore","4",93,2007,2014,"Cancer research|Breast cancer|CA15-3|Pathology|Gene expression|RNA interference|Surgical oncology|Motility|Cell growth|Medicine","Journal publications","Edison T. Liu|Kartiki V. Desai|Lance D. Miller|Brendan Pang|Michael A. Black|Xiu Bin Chan|Chee Wee Ong|Manuel Salto-Tellez|Wendy WeiJia Soon|Koichiro Inaki","Breast Cancer Research|Genome Research|Clinical Cancer Research","Genome Institute of Singapore|Queen's University Belfast|National University of Singapore|Wake Forest University|University of Otago|Université de Sherbrooke|Massachusetts Institute of Technology",NA,NA
"Meiou Dai","McGill University","11",315,2008,2018,"Cancer research|Biology|Breast cancer|Cancer|Medicine|Triple-negative breast cancer|Molecular biology|Metastasis|Internal medicine|Transforming growth factor beta","Journal publications","Jean-Jacques Lebrun|Suhad Ali|Jun Tian|Nadège Fils-Aimé|Jimin Guo|Amal A Al-Odaini|Fatmah Al Raffa|Shafaat A. Rabbani|Ani Arakelian|Chieh Lo","Journal of Biological Chemistry|Breast Cancer Research|Scientific Reports|British Journal of Cancer|Cellular Signalling|Cancer Research","McGill University|Malaysian Ministry of Higher Education|St Mary's Hospital|Third Military Medical University",NA,NA
"Zhaojia Wu","Capital Normal University","4",47,2012,2018,"Biology|Metastasis|Cancer research|Transcription factor|Cell biology|Cancer|Innate immune system|In vivo|Inflammation|Colorectal cancer","Journal publications","Wei Xiao|Weiwei Zhang|Heather Neufeld|Eminao Torlakovic|Zhiling Zhang|Siqi Shen|J. Justin McCormick|Veronica M. Maher|Audesh Bhat|Mengxue Lu","Oncotarget|Breast Cancer Research|Cell Cycle|FEBS Letters","Capital Normal University|University of Saskatchewan|Michigan State University",NA,NA
"Alexandr V. Bazhin","Ludwig Maximilian University of Munich","128",1842,2001,2019,"Biology|Immunology|Medicine|Cancer research|Cancer|Pancreatic cancer|Immune system|Tumor microenvironment|Molecular biology|Internal medicine","Journal publications|Other","Jens Werner|Svetlana Karakhanova|Pavel P. Philippov|Dirk Schadendorf|Stefan B. Eichmüller|Yuhui Yang|Viktor Umansky|Jan G. D’Haese|Ivan Shevchenko|Markus Guba","International Journal of Cancer|Journal of Cellular Physiology|Proceedings of the National Academy of Sciences of the United States of America|Biochemistry|Current Medicinal Chemistry|Oncotarget|International Reviews of Immunology|Experimental Dermatology|Cancer Immunology, Immunotherapy|OncoImmunology","Heidelberg University|Ludwig Maximilian University of Munich|German Cancer Research Center|Moscow State University|University Hospital Heidelberg|University of Duisburg-Essen|Chubu University|Hebrew University of Jerusalem|Hannover Medical School|French Institute of Health and Medical Research",NA,NA
"Marina S. Savchenko","Moscow State University","11",184,2001,2018,"Medicine|Pathology|Cancer|Lung cancer|Recoverin|Antigen|Small Cell Lung Carcinoma|Autoantibody|Cornea|Carcinoma","Journal publications","Pavel P. Philippov|Alexandr V. Bazhin|Ivan I. Senin|Olga N. Shifrina|Alexandr G. Chuchalin|Andrey A. Zamyatnin|Marina O. Golovastova|O. S. Gancharova|Viktoriia E. Baksheeva|Sofia A. Demoura","Lung Cancer|Biochemistry|Oncology Letters|Oxidative Medicine and Cellular Longevity|Bulletin of Experimental Biology and Medicine|Biochemistry (moscow) Supplement Series B: Biomedical Chemistry|European Respiratory Journal","Moscow State University|Academy of Medical Sciences, United Kingdom|Heidelberg University|I.M. Sechenov First Moscow State Medical University",NA,NA
"Stephana Carelli","University of Milan","47",907,1993,2019,"Biology|Erythropoietin|Immunology|Spinal cord injury|Medicine|Neuroscience|Cell biology|Biochemistry|Pathology|Pharmacology","Journal publications|Other","Anna Maria Di Giulio|Alfredo Gorio|Toniella Giallongo|L. Madaschi|Elisa Latorre|Elena Lesma|Federica Rey|Giovanni Marfia|Mattia Colli|Giorgio Ghilardi","Proceedings of the National Academy of Sciences of the United States of America|Biochimica et Biophysica Acta|International Journal of Molecular Sciences|Cell Transplantation|American Journal of Pathology|Neurological Sciences|Asn Neuro|Cells|Neurobiology of Disease|Neurology Research International","University of Milan|University of Catania|University of Trento|Ohio State University|University of Brescia|University of Pavia|University of Pavol Jozef Šafárik|Duke University|University of Pisa|European Institute of Oncology",NA,NA
"Katherine M. Finan","Royal Adelaide Hospital","3",31,2004,2016,"Apoptosis|In vivo|Gene delivery|Pathology|Medicine|Matrix metalloproteinase|Genetic enhancement|Genetic transfer|Fas ligand|Cell culture","Journal publications","Mark Holmes|Paul N. Reynolds|Ann M. Reynolds|Sandra Hodge|Andrew H. Baker|Greg Hodge","Lung Cancer|Molecular Therapy","Boston Children's Hospital|Royal Adelaide Hospital|University of Adelaide|University of Glasgow",NA,NA
