"first_author","affiliation","publications","citations","year_start","year_end","top_topics","publication_types","top_authors","top_journals","top_institutions","top_conferences","not_found"
"Kang Fang","National Taiwan Normal University","51",1202,1986,2018,"Biology|Apoptosis|Cell culture|Cancer research|Cell|Molecular biology|Programmed cell death|Cancer|Cell biology|Immunology","Journal publications|Repository papers|Other","Chien-Chih Chiu|Jing Ping Wang|Y. S. Lai|I. C. Guo|Chun Yen Liu|S. C. Chen|Chang Heng Hsieh|S. Murali|C. Y. Chang|Ching-Fa Yao","Journal of Fish Diseases|Apoptosis|Journal of Agricultural and Food Chemistry|Clinical Genetics|Cancer Research|Lung Cancer|Oncology Letters|Drug Design Development and Therapy|Molecular and Cellular Biochemistry|International Journal of Oncology","National Taiwan Normal University|Kaohsiung Medical University|National Taiwan University|Academia Sinica|National Cheng Kung University|University of Texas MD Anderson Cancer Center|China Medical University (PRC)|National Taiwan Ocean University|Memorial Hospital of South Bend|Technische Universität München",NA,NA
"Shun-Dong Dai","China Medical University (PRC)","37",662,2006,2015,"Biology|Lung cancer|Pathology|Cancer research|Immunohistochemistry|Catenin|Medicine|Immunology|Cancer|Cadherin","Journal publications|Other","Enhua Wang|Hong-Tao Xu|Yan Wang|Yuan Miao|Yang Han|Yang Liu|Qingchang Li|Juan-Han Yu|Guiyang Jiang|Yue Zhao","PLOS ONE|Diagnostic Pathology|Apmis|International Journal of Clinical and Experimental Pathology|The Journal of Pathology|BMC Cancer|Targeted Oncology|Lung Cancer|Cancer Science|Molecular Carcinogenesis","China Medical University (PRC)|Linköping University|Duke University|University of Texas MD Anderson Cancer Center",NA,NA
"Kazutoshi Komiya","Saga University","58",348,2004,2019,"Medicine|Pathology|Internal medicine|Biology|Mutation|Lung cancer|Molecular biology|T790M|Cancer|genomic DNA","Journal publications","Shinya Kimura|Naoko Sueoka-Aragane|Tomomi Nakamura|Eisaburo Sueoka|Akemi Sato|Shinichiro Hayashi|Kentaro Iwanaga|Mitsuharu Hirai|Toshiya Hosomi|Tomonori Abe","Journal of Thoracic Oncology|Lung Cancer|Annals of Oncology|Cancer Research|Journal of Cancer Research and Clinical Oncology|Journal of Clinical Oncology|Journal of Medical Case Reports|Biomarker Insights|Case reports in rheumatology|Case Reports in Oncology","Saga University|Saga Group|Kumamoto University|Kyushu University|Oita University|Japanese Foundation for Cancer Research|Takasaki University of Health and Welfare|Kanazawa University|Chonnam National University|Yamagata University",NA,NA
"Hakan Akca","Pamukkale University","41",452,2004,2019,"Biology|Cancer research|Cell culture|Protein kinase B|Molecular biology|Chemistry|PTEN|Genetics|PI3K/AKT/mTOR pathway|Lung cancer","Journal publications|Other","Onur Tokgun|Aydin Demiray|Jun Yokota|Bülent Kaya|Esref Demir|Fatma Turna|Durmus Burgucu|Gerard Vales|Sezgin Aksakal|Amadeu Creus","Lung Cancer|Journal of Hazardous Materials|Cancer Genetics and Cytogenetics|Cancer Cell International|Environmental Research|Molecular Biotechnology|Journal of Enzyme Inhibition and Medicinal Chemistry|Tumor Biology|Journal of Medicinal Food|Psychiatry Research-neuroimaging","Pamukkale University|Akdeniz University|Autonomous University of Barcelona|Ciber|University of Sassari|Epigenomics AG|Kafkas University|Yüzüncü Yil University|Usak University|Selçuk University",NA,NA
"Norimitsu Tanaka","Okayama University","43",698,1987,2017,"Medicine|Cancer research|Pathology|Biology|Lung cancer|Molecular biology|Cell culture|Methylation|Internal medicine|Oncology","Journal publications|Other","Shinichi Toyooka|Shinichiro Miyoshi|Kazunori Tsukuda|Junichi Soh|Hiroaki Asano|Yuho Maki|Kazuhiko Shien|Takayuki Muraoka|Masashi Furukawa|Tsuyoshi Ueno","Lung Cancer|Cancer Research|Oncology Reports|Acta Medica Okayama|Anticancer Research|PLOS ONE|Diseases of The Esophagus|Oncology Letters|Molecular and Clinical Oncology|Journal of Cancer Research and Clinical Oncology","Okayama University|Kawasaki Medical School|New York University",NA,NA
"Dusanka S. Skundric","Wayne State University","24",612,1994,2020,"Immunology|Biology|Multiple sclerosis|Cytokine|Experimental autoimmune encephalomyelitis|Medicine|T cell|Pathology|Central nervous system|Schwann cell","Journal publications|Other","Robert P. Lisak|William W. Cruikshank|Rujuan Dai|Harley Y. Tse|Paul C. Montgomery|Beverly Bealmear|Djordje Gveric|Juan Cai|Vaagn L. Zakarian|Weili Zhou","Journal of Neuroinflammation|Journal of Neuroimmunology|Cytokine|Experimental Diabesity Research|Annals of the New York Academy of Sciences|Neural Regeneration Research|Journal of Neuroscience Research|Journal of Autoimmunity|Molecular Neurodegeneration|Multiple Sclerosis Journal","Wayne State University|Boston University|University College London|University of Colorado Denver|University of Belgrade|University of Graz",NA,NA
"Pascale Gerbaud","University of Paris","6",294,1996,2014,"Biology|Psoriasis|Superoxide dismutase|Fibroblast|Molecular biology|Immunology|Biochemistry|Human chorionic gonadotropin|Trophoblast|Cytotrophoblast","Journal publications","Danièle Evain-Brion|Wayne B. Anderson|Patrice Thérond|Françoise Raynaud|J. Guibourdenche|Guillaume Pidoux|Fatima Ferreira|Josette Badet|Geri Meduri|Jean-Louis Frendo","Journal of Investigative Dermatology|Journal of Cellular Physiology|Journal of Autoimmunity|Free Radical Biology and Medicine|Placenta","University of Paris|National Institutes of Health|Centre national de la recherche scientifique|French Institute of Health and Medical Research|Paris Descartes University",NA,NA
"M. Sisto","University of Bari","83",1186,2000,2020,"Biology|Immunology|Inflammation|Autoantibody|Salivary gland|Autoimmunity|Autoimmune disease|Cancer research|Cytokine|Apoptosis","Journal publications|Other","Sabrina Lisi|Massimo D’Amore|Dario Domenico Lofrumento|Vincenzo Mitolo|Domenico Ribatti|Maria Antonietta Panaro|A. Acquafredda|P. Scagliusi|Giuseppe Ingravallo|Loredana Lorusso","Clinical and Experimental Medicine|Histochemistry and Cell Biology|Journal of Autoimmunity|Immunopharmacology and Immunotoxicology|Laboratory Investigation|Annals of the New York Academy of Sciences|Immunology Letters|Journal of Medical Microbiology|Pathology|International Immunology","University of Bari|University of Salento|University of Wisconsin-Madison|DIM",NA,NA
"Itshak Golan","Hebrew University of Jerusalem","20",953,2000,2009,"Biology|CD44|Immunology|Cell|Molecular biology|Cell biology|Cellular differentiation|Cell signaling|Cluster of differentiation|Cell growth","Journal publications|Patents|Other","David Naor|Shlomo Nedvetzki|Dan Caspi|Lora Melnik|Yoram Faitelson|Ira Golan|Lora Eshkar Sebban|Yehiel Zick|Avner Yayon|Ori Elkayam","Critical Reviews in Clinical Laboratory Sciences|Journal of Immunology|Journal of Clinical Investigation|Annals of the New York Academy of Sciences|Journal of Autoimmunity|The Open Rheumatology Journal|Cell Adhesion and Communication","Hebrew University of Jerusalem|Weizmann Institute of Science|University of Western Ontario",NA,NA
"Xiaoyan Xiao","Yale University","6",187,2009,2016,"Diabetes mellitus|Biology|Internal medicine|Endocrinology|NOD mice|Nod|Immunology|Medicine|Hepatitis|Diabetic cardiomyopathy","Journal publications","Li Wen|F. Susan Wong|Peng Zhao|Ningwen Tai|Dake Qi|Baojun Dong|Li Chen|Long Yang|Yan Huang|Lena Alexopoulou","American Journal of Physiology-heart and Circulatory Physiology|Journal of Immunology|Journal of Autoimmunity|Archives of Medical Research|Clinical and Experimental Immunology","Yale University|Shandong University|Cardiff University|Howard Hughes Medical Institute|University of Bristol|New York University|King's College London|Ghent University Hospital|Institut national de la recherche scientifique",NA,NA
"Dana Ben-Ami Shor","Sheba Medical Center","34",1066,2009,2019,"Medicine|Pediatrics|Childhood obesity|Overweight|Body mass index|Young adult|Immunology|Heart disease|Cause of death|Sudden death","Journal publications|Other","Gilad Twig|Adi Leiba|Nehama Goldberger|Hagai Levine|Ziona Haklai|Dorit Tzur|Arnon Afek|Estela Derazne|Ari Shamiss|Gal Yaniv","The New England Journal of Medicine|Autoimmunity Reviews|Journal of Autoimmunity|Clinical Reviews in Allergy & Immunology|Diabetes Care|Gastroenterology|The Journal of Clinical Endocrinology and Metabolism|Annals of the New York Academy of Sciences|European Journal of Endocrinology|European Journal of Pediatrics","Tel Aviv University|Sheba Medical Center|Medical Corps|Ben-Gurion University of the Negev|Brigham and Women's Hospital|Hebrew University of Jerusalem|Israel Ministry of Health|Clalit Health Services|Weizmann Institute of Science|Albert Einstein College of Medicine",NA,NA
"Sawsan I. Kreydiyyeh","American University of Beirut","56",1194,1990,2019,"Biochemistry|Biology|Chemistry|Na+/K+-ATPase|ATPase|Internal medicine|Endocrinology|Eugenol|Linalool|Botany","Journal publications","Julnar Usta|Shawky M. Dagher|Khouzama M. Knio|H. Zournajian|Khuzama Knio|Ola El-Zein|Pascale Barnabe|Yolla Bou-Moughlabay|Rana Al-Sadi|Antoine T. Chalfoun","Bioresource Technology|Journal of Ethnopharmacology|Food and Chemical Toxicology|Journal of Experimental Marine Biology and Ecology|PLOS ONE|Life Sciences|Chemico-Biological Interactions|Cytokine|Phytomedicine|Human & Experimental Toxicology","American University of Beirut|Beirut Arab University|Florida State University|University of California, San Diego|Kuwait University|University of Minnesota|United States Public Health Service",NA,NA
"Ji-Yong Zhou","Zhejiang University","25",776,2004,2019,"Biology|Virology|Molecular biology|Virus|Recombinant DNA|Fusion protein|Antibody|Epitope|Goose|Monoclonal antibody","Journal publications|Patents","Hui-Gang Shen|Junqing Guo|Jianxiang Wu|Shao-Bin Shang|Qing-Xin Chen|Hongxun Chen|Hui Gong|Jianxin Liu|Guang-Zhi Tong|Ming Liao","Journal of General Virology|Journal of Biotechnology|Plant Biotechnology Journal|FEBS Letters|Veterinary Research Communications|Molecular Immunology|Research in Veterinary Science|Cytokine|Chinese Journal of Biotechnology|Protein Expression and Purification","Zhejiang University|China Agricultural University|Harbin Veterinary Research Institute|Ministry of Education|Rice University|Wuhan University|Boston Children's Hospital|Chinese Ministry of Education",NA,NA
"Sarine Markossian","American University of Beirut","4",122,2003,2006,"ATPase|Kidney|Chemistry|Biochemistry|Diuretic|Pimpinella|Intestinal absorption|Homogenization (biology)|Chromatography|Sodium","Journal publications","Sawsan Ibrahim Kreydiyyeh|Julnar Usta|Khuzama Knio|Shawky M. Dagher|Rawad Hodeify","Life Sciences|Cytokine|Prostaglandins & Other Lipid Mediators","American University of Beirut",NA,NA
"Hwa-Jeong Lee","Wonkwang University","25",671,2005,2010,"Biology|Cancer cell|Heme oxygenase|Biochemistry|Molecular biology|Keratinocyte|Pathology|Medicine|Viability assay|HaCaT","Journal publications|Other","Eun-Cheol Kim|Suk-Keun Lee|Sun-Kyung Lee|Byung-Hun Jeon|Chang-Duk Jun|Kyung-San Min|Jun Lee|Youngho Kim|Hyun-Ock Pae|Myung Hee Park","Journal of Endodontics|Journal of Oral Pathology & Medicine|Phytotherapy Research|The American Journal of Chinese Medicine|Journal of Periodontology|Cell Biology International|Life Sciences|Toxicology in Vitro|Cytokine|BMC Cancer","Wonkwang University|Kyungpook National University|National Institutes of Health|Cheongju University|The Catholic University of America|Gwangju Institute of Science and Technology",NA,NA
"Maria de Lujan Alvarez","National Scientific and Technical Research Council","42",429,2000,2019,"Internal medicine|Endocrinology|Biology|Biochemistry|Apoptosis|Chemistry|Programmed cell death|Liver cancer|Oxidative stress|Medicine","Journal publications|Other","María Cristina Carrillo|Cristina E. Carnovale|María Teresa Ronco|Ariel D. Quiroga|Gerardo B. Pisani|Juan Pablo Parody|María Paula Ceballos|Juan A. Monti|Daniel E. Francés|Florencia Lorenzetti","Biochimica et Biophysica Acta|Biochemical Pharmacology|Journal of Hepatology|Molecular Nutrition & Food Research|Toxicology and Applied Pharmacology|Journal of Nutritional Biochemistry|Hepatology|Growth Factors Journal|Cytokine|European Journal of Nutrition","National Scientific and Technical Research Council|Facultad de Ciencias Médicas|Spanish National Research Council|Universidad Abierta Interamericana|University of Buenos Aires|Université Paris-Saclay|National University of Rosario",NA,NA
"Marilena Galdiero","Seconda Università degli Studi di Napoli","83",1290,1988,2019,"Biology|Immunology|Microbiology|Porin|Virology|Medicine|Signal transduction|Cytokine|Proinflammatory cytokine|Lipopolysaccharide","Journal publications|Other","Mariateresa Vitiello|Massimiliano Galdiero|Emiliana Finamore|Stefania Galdiero|Marina D'Isanto|Emilia Galdiero|F. Galdiero|Gianluigi Franci|Annarita Falanga|Allan A. Pacey","Lancet Infectious Diseases|Cytokine|Infection and Immunity|International Journal of Nanomedicine|Molecular BioSystems|Marine Drugs|Microbiology|Clinical and Vaccine Immunology|New Microbiologica|RSC Advances","Seconda Università degli Studi di Napoli|University of Naples Federico II|University of Sheffield|New York University|National Research Council|International Institute of Minnesota|ARCO",NA,NA
"Sawsan Ibrahim Kreydiyyeh","American University of Beirut","56",1194,1990,2019,"Biochemistry|Biology|Chemistry|Na+/K+-ATPase|ATPase|Internal medicine|Endocrinology|Eugenol|Linalool|Botany","Journal publications","Julnar Usta|Shawky M. Dagher|Khouzama M. Knio|H. Zournajian|Khuzama Knio|Ola El-Zein|Pascale Barnabe|Yolla Bou-Moughlabay|Rana Al-Sadi|Antoine T. Chalfoun","Bioresource Technology|Journal of Ethnopharmacology|Food and Chemical Toxicology|Journal of Experimental Marine Biology and Ecology|PLOS ONE|Life Sciences|Chemico-Biological Interactions|Cytokine|Phytomedicine|Human & Experimental Toxicology","American University of Beirut|Beirut Arab University|Florida State University|University of California, San Diego|Kuwait University|University of Minnesota|United States Public Health Service",NA,NA
"Deok-Ho Song","Chungbuk National University","5",24,2003,2007,"Tumor necrosis factor alpha|Immunology|Phagocytosis|Biology|Peroxisome proliferator-activated receptor|Messenger RNA|Peroxisome|Downregulation and upregulation|Receptor|Conjugated linoleic acid","Journal publications|Other","Ji-Houn Kang|Mhan-Pyo Yang|Geun-Shik Lee|Eui-Bae Jeung|In-Kyung Ko|Jung-hwa Sin|Hyun-ah Kim","Cytokine|Veterinary Immunology and Immunopathology","Chungbuk National University",NA,NA
"Chung-Hsi Hsing","Taipei Medical University","25",467,2002,2018,"Medicine|Immunology|Cytokine|Interleukin|Proinflammatory cytokine|Pathology|Internal medicine|Interleukin 19|Inflammation|Metastasis","Journal publications|Other","Ming-Shi Chang|Yu Hsiang Hsu|Chien Feng Li|Wei Yu Chen|Ching Hua Yeh|Hsing Hui Li|Mei Yi Hsieh|Chuan Chih Hsu|Bor Chih Cheng|Edmund Cheung So","PLOS ONE|The Annals of Thoracic Surgery|Journal of Biomedical Science|Cytokine|European Journal of Pharmacology|Scientific Reports|Shock|Journal of Immunology|Clinical Cancer Research|Nephrology Dialysis Transplantation","National Cheng Kung University|Taipei Medical University|National Taiwan University|Chang Jung Christian University|Chia Nan University of Pharmacy and Science|China Medical University (PRC)|National Health Research Institutes|National Yang-Ming University|Shandong University|National Formosa University",NA,NA
"M. HyzdÕalov‡","Academy of Sciences of the Czech Republic","4",68,2008,2011,"Biology|Cell culture|Apoptosis|Cellular differentiation|Butyrate|Cell|Cell biology|Docosahexaenoic acid|Sodium butyrate|Cell cycle","Journal publications","Alois Kozubík|Alena Hyršlová Vaculová|Jirina Hofmanová|Zuzana Sovjáková Koubková|Lenka Kocí|Jirina Hofmanova|Jirí Pacherník|Zuzana Pernicová|David Vydra|Radek Trojanec","Molecular Nutrition & Food Research|Cytokine|Cancer Genetics and Cytogenetics","Academy of Sciences of the Czech Republic|Masaryk University|Palacký University, Olomouc",NA,NA
"Taku Inokuchi","Hyogo College of Medicine","34",440,2004,2010,"Internal medicine|Endocrinology|Medicine|Uric acid|Diabetes mellitus|Chemistry|Excretion|Gout|Hypoxanthine|Purine","Journal publications|Conference publications|Other","Yuji Moriwaki|Sumio Takahashi|Zenta Tsutsumi|Tetsuya Yamamoto|Asako Yamamoto|Tuneyoshi Ka|Tsuneyoshi Ka|Seiichi Hirota|Hiroki Shima|Takiuchi H","Magnetic Resonance Imaging|Metabolism-clinical and Experimental|Internal Medicine|Hormone and Metabolic Research|Jcr-journal of Clinical Rheumatology|Acta Diabetologica|Cytokine|Nucleosides, Nucleotides & Nucleic Acids|Japanese Circulation Journal-english Edition|Clinica Chimica Acta","Hyogo College of Medicine|Shimane University|Tottori University","CP: Principles and Practice of Constraint Programming",NA
"Zhao Huang","Shaanxi Normal University","4",0,2019,2019,"Computer science|Distributed computing|Information retrieval|Recommender system|The Internet|Euclidean distance|Semantic similarity|Service discovery|Cosine similarity|Web service","Conference publications|Journal publications","Pavel Stakhiyevich|Wei Zhao|Wei Zhao|Liu Yuan|Pavel Stakhiyevich","Electronic Commerce Research","Shaanxi Normal University","HPCC: High Performance Computing and Communications|UbiComp: Ubiquitous Computing",NA
"Aramati B.M. Reddy","University of Texas Medical Branch","22",763,2006,2019,"Aldose reductase|Biology|Biochemistry|Inflammation|Molecular biology|Tumor necrosis factor alpha|Chemokine|Proinflammatory cytokine|Protein kinase C|Oxidative stress","Journal publications","Kota V. Ramana|Ravinder Tammali|Satish K. Srivastava|Aruni Bhatnagar|Ashish Saxena|Satish K. Srivastava|Mohammad Shoeb|Sanjay Srivastava|Umesh C. S. Yadav|Ashok K. Chopra","Chemico-Biological Interactions|Journal of Biological Chemistry|Carcinogenesis|Investigative Ophthalmology & Visual Science|Endocrinology|Angiogenesis|Free Radical Biology and Medicine|Cytokine|International Immunopharmacology|The International Journal of Biochemistry & Cell Biology","University of Texas Medical Branch|University of Louisville|University of Colorado Denver|University of North Texas|University of Kentucky|Washington University in St. Louis|Visual Sciences",NA,NA
"Kumiko Goto","Hoshi University","12",332,2008,2010,"Downregulation and upregulation|RHOA|Biology|Contraction (grammar)|Cell biology|Pathology|microRNA|Cell|Bronchial hyperresponsiveness|Ovalbumin","Journal publications","Yoshihiko Chiba|Miwa Misawa|Hiroyasu Sakai|Miki Tanabe|Shioko Kimura|Yoshiyuki Hattori|Kimihiko Matsusue|Yoshie Maitani|Kimihiko Matsusue|Motohiko Hanazaki","American Journal of Respiratory and Critical Care Medicine|Pharmacological Research|Journal of Pharmacological Sciences|Pflügers Archiv: European Journal of Physiology|Cytokine|European Journal of Pharmacology|Journal of Smooth Muscle Research|Biological & Pharmaceutical Bulletin","Hoshi University|National Institutes of Health|Fukuoka University",NA,NA
"Surinder Safaya","Boston University","11",104,1999,2013,"Biology|Genetics|Single-nucleotide polymorphism|Haplotype|Sickle cell anemia|Molecular biology|Immunology|Locus (genetics)|Allele|Fetal hemoglobin","Journal publications|Other|Conference publications","Martin H. Steinberg|Clinton T. Baldwin|Efthymia Melista|Nadia Solovieff|Paola Sebastiani|Idowu Akinsheye|Duyen A. Ngo|Ahmed M. Al-Suliman|Waleed H. Albuali|John J. Farrell","Blood Cells Molecules and Diseases|American Journal of Hematology|Molecular Immunology|Cytokine|Physiological Genomics|Blood|The American Journal of the Medical Sciences","Boston University|King Saud University|King Faisal University|Yale University|University of Dammam|University of Mississippi|Tougaloo College","ATS: American Thoracic Society International Conference",NA
"Yanping Yang","Sanofi Pasteur","72",993,1990,2013,"Biology|Virology|Microbiology|Haemophilus influenzae|Immunology|Recombinant DNA|Transferrin receptor|Antigen|Bacterial vaccine|Escherichia coli","Journal publications|Patents|Other","Sheena M. Loosmore|Michel H. Klein|Robin E. Harkness|Run-Pan Du|Lisa E. Myers|Michel H. Klein|Anthony B. Schryvers|Pele Chong|Qijun Wang|Debbie C. Coleman","Infection and Immunity|Vaccine|Fems Immunology and Medical Microbiology|Molecular Microbiology|Developments in biologicals|Advances in Experimental Medicine and Biology","University of Calgary|Sanofi Pasteur|St. Louis Children's Hospital|Ohio State University",NA,NA
"Ari Kassardjian","American University of Beirut","3",27,2007,2010,"Na+/K+-ATPase|Biology|Caspase|Molecular biology|Biochemistry|ATPase|Sodium-Potassium-Exchanging ATPase|Downregulation and upregulation|Tumor necrosis factor alpha|NF-<U+03BA>B","Journal publications","Sawsan Ibrahim Kreydiyyeh|Zeina Dakroub|Ola El Zein|Maya F. Serhan|Sarah Riman","Journal of Cellular Physiology|Cytokine|Prostaglandins & Other Lipid Mediators","American University of Beirut",NA,NA
"Hong Yu","Medical University of South Carolina","28",555,2004,2016,"Biology|Molecular biology|Immunology|Inflammation|MAPK/ERK pathway|Cytokine|Medicine|Aggregatibacter actinomycetemcomitans|Proinflammatory cytokine|Cancer research","Journal publications","Keith L. Kirkwood|Bethany A. Herbert|Qiyan Li|Maria F. Lopes-Virella|Xiaoming Zhang|Yanchun Li|Yan Huang|Zhongyang Lu|Renny T. Franceschi|Guisheng Zhao","Journal of Dental Research|Journal of Bone and Mineral Research|Cancer Research|Cytokine|Gene Therapy|Journal of Biological Chemistry|Journal of Periodontal Research|Journal of Lipid Research|PLOS ONE|Lipids in Health and Disease","Medical University of South Carolina|University of Michigan|College of Charleston|Clemson University|Guilin Medical University|United States Army Medical Research Institute of Infectious Diseases",NA,NA
"Markus Neumeier","University of Regensburg","88",4230,2005,2019,"Internal medicine|Endocrinology|Biology|Adiponectin|Adipokine|Medicine|Adipocyte|Adipose tissue|Biochemistry|Inflammation","Journal publications|Other","Christa Buechler|Andreas Schäffler|Johanna Weigert|Jürgen Schölmerich|Josef Wanninger|Charalampos Aslanidis|Andrea Kopp|Sabrina Bauer|J. Schölmerich|Thomas S. Weiss","Biochimica et Biophysica Acta|Endocrinology|FEBS Letters|Clinical Endocrinology|Biochemical and Biophysical Research Communications|Immunology|World Journal of Gastroenterology|Cytokine|Obesity|Inflammatory Bowel Diseases","University of Regensburg|University of Washington|University of Sydney|University of Barcelona|Boston University",NA,NA
"Ping Chen","Hunan Normal University","40",941,2000,2020,"Chromatography|Membrane protein|Biochemistry|Chemistry|Biology|Proteomics|Membrane|Mass spectrometry|Proteome|Centrifugation","Journal publications","Songping Liang|Xianchun Wang|Rui Cao|Yong Lin|Zhen Liu|Xuanwen Li|Jian Zhou|Quanyuan He|Jixian Xiong|Jianglin Li","Journal of Proteome Research|Electrophoresis|Analytical Biochemistry|Stem Cells International|Journal of Neurochemistry|Rapid Communications in Mass Spectrometry|Cell Transplantation|Proteomics|Toxicon|Molecular and Cellular Biochemistry","Hunan Normal University|Chongqing Medical University|Hunan Agricultural University|Central South University|Hunan University|Fujian University of Traditional Chinese Medicine",NA,NA
"Ye Zeng","Sichuan University","48",712,1993,2019,"Biology|Glycocalyx|Heparan sulfate|Cell biology|Cancer research|Syndecan 1|Biochemistry|Endothelial stem cell|Immunology|Chondroitin sulfate","Journal publications|Patents|Other","John M. Tarbell|Xiaoheng Liu|Jiang Wu|Jingxia Liu|Zhiping Yan|Xinghong Yao|Bingmei M. Fu|Eno E. Ebong|Roger H. Adamson|Fitz Roy E Curry","PLOS ONE|American Journal of Physiology-heart and Circulatory Physiology|International Journal of Cancer|Oncotarget|Oncology Letters|Cellular and Molecular Biology|Progress in Biophysics & Molecular Biology|Experimental Cell Research|International Journal of Molecular Medicine|PeerJ","Sichuan University|City College of New York|City University of New York|Albert Einstein College of Medicine|University of California, Davis|Harvard University|Kettering University|Ohio State University|Sun Yat-sen University|Xinjiang Medical University",NA,NA
"Yue Wang","Tianjin University","18",593,2010,2019,"Biology|MAPK/ERK pathway|Protein kinase B|PI3K/AKT/mTOR pathway|Autocrine signalling|Cancer research|Immunology|XIAP|Cell biology|Cisplatin","Journal publications|Other|Patents","Ling Zhi Li|Ye Qu|Wei Jia Sun|Xiu Long Niu|Xiao Lei Zhang|Ya Qin Zhu|Jian Wu|Rui Cheng Xu|Xin Jin|Jing Sun","Cytokine|Cancer Letters|Phytomedicine|Molecular and Cellular Endocrinology|Scientific Reports|Nutrition Research|International Immunopharmacology|Cell and Tissue Research|Chinese Herbal Medicines|Journal of Molecular Endocrinology","Tianjin University|Tianjin Medical University",NA,NA
"Hong-Xia Wang","Capital Medical University","44",728,2009,2019,"Internal medicine|Endocrinology|Biology|Medicine|Apoptosis|Angiotensin II|Ischemia|Protein kinase B|Inflammation|Receptor","Journal publications","Hui-Hua Li|Jie Du|Xiang-Jun Zeng|Hui Yang|Cui Tian|Chaoshu Tang|Yunlong Xia|Lei Wang|Fenghe Du|Caixia Guo","PLOS ONE|Peptides|Apoptosis|Free Radical Biology and Medicine|American Journal of Hypertension|Cellular Physiology and Biochemistry|Hypertension|Life Sciences|Scientific Reports|Heart and Vessels","Capital Medical University|Dalian Medical University|Temple University|Xi'an Jiaotong University|Peking University|Shandong University of Traditional Chinese Medicine|Shandong University|University of Maryland, College Park|Peking Union Medical College Hospital|Beijing Jishuitan Hospital",NA,NA
